Player name,Country,Opponent team,Runs Scored,Balls played,Four,Six,Strike Rate,Balls bowled,over,Runs Given,Wickets,Maiden Over,Economy,Venue,runout,catch,year,Total Score
DCStovell,Bermuda,Cayman Islands,18,16,2,0,112.5,23,3,21,2,0,7.0,White Hill Field Sandys Parish,1,1,2019,90
DCStovell,Bermuda,Papua New Guinea,1,5,0,0,20.0,7,1,8,0,0,8.0,ICC Academy,0,0,2019,-5
DCStovell,Bermuda,Kenya,4,5,0,0,80.0,17,2,15,0,0,7.5,ICC Academy,0,1,2019,12
DCStovell,Bermuda,Singapore,0,1,0,0,0.0,12,2,18,1,0,9.0,ICC Academy Ground No 2,0,0,2019,17
DCStovell,Bermuda,Scotland,12,10,2,0,120.0,24,4,40,1,0,10.0,Dubai International Cricket Stadium,0,0,2019,37
DCStovell,Bermuda,Netherlands,7,13,1,0,53.84615384615385,17,2,25,0,0,12.5,Dubai International Cricket Stadium,0,0,2019,-2
