SRWaters,Kenya,South Africa,15,23,2,0,65.21739130434783,0,0,0,0,0,0,OUTsurance Oval,0,0,2008,15
SRWaters,Kenya,Canada,2,13,0,0,15.384615384615385,0,0,0,0,0,0,Feroz Shah Kotla,0,0,2011,-4
SRWaters,Kenya,Canada,14,33,2,0,42.42424242424242,0,0,0,0,0,0,Maple Leaf North-West Ground,0,0,2009,10
SRWaters,Kenya,Zimbabwe,0,1,0,0,0.0,0,0,0,0,0,0,Gymkhana Club Ground,0,0,2009,-8
SRWaters,Kenya,Pakistan,17,31,2,0,54.83870967741935,0,0,0,0,0,0,Mahinda Rajapaksa International Cricket Stadium Sooriyawewa,0,1,2011,23
SRWaters,Kenya,New Zealand,16,42,1,0,38.095238095238095,0,0,0,0,0,0,MA Chidambaram Stadium Chepauk,0,0,2011,11
