Player name,Country,Opponent team,Runs Scored,Balls played,Four,Six,Strike Rate,Balls bowled,over,Runs Given,Wickets,Maiden Over,Economy,Venue,runout,catch,year,Total Score
AKPerera,Sri Lanka,Bangladesh,0,0,0,0,0,5,0,17,0,0,0,Pallekele International Cricket Stadium,0,1,2013,8
AKPerera,Sri Lanka,Bangladesh,4,9,0,0,44.44444444444444,0,0,0,0,0,0,Zahur Ahmed Chowdhury Stadium,0,0,2014,-2
AKPerera,Sri Lanka,Pakistan,13,11,1,0,118.18181818181819,0,0,0,0,0,0,Gaddafi Stadium,0,0,2019,14
AKPerera,Sri Lanka,Pakistan,13,25,0,0,52.0,0,0,0,0,0,0,National Stadium,0,0,2019,9
AKPerera,Sri Lanka,South Africa,1,5,0,0,20.0,0,0,0,0,0,0,Pallekele International Cricket Stadium,0,0,2013,-5
AKPerera,Sri Lanka,Bangladesh,0,0,0,0,0,17,2,17,0,0,8.5,Shere Bangla National Stadium,0,1,2014,8
AKPerera,Sri Lanka,Australia,7,16,0,0,43.75,5,0,5,0,0,0,Rangiri Dambulla International Stadium,0,0,2016,1
