Player name,Country,Opponent team,Runs Scored,Balls played,Four,Six,Strike Rate,Balls bowled,over,Runs Given,Wickets,Maiden Over,Economy,Venue,runout,catch,year,Total Score
AOSuji,Kenya,Ireland,7,18,0,0,38.88888888888889,19,3,27,0,1,9.0,Civil Service Cricket Club Stormont,0,1,2008,17
AOSuji,Kenya,Pakistan,4,8,0,0,50.0,0,0,0,0,0,0,Gymkhana Club Ground,0,0,2007,0
AOSuji,Kenya,Canada,0,0,0,0,0,18,3,27,0,0,9.0,Dubai International Cricket Stadium,0,0,2010,0
AOSuji,Kenya,Scotland,3,7,0,0,42.857142857142854,6,1,7,0,0,7.0,Cambusdoon New Ground,0,0,2008,-3
AOSuji,Kenya,England,14,29,2,0,48.275862068965516,18,3,15,0,0,5.0,Beausejour Stadium Gros Islet,0,0,2007,12
